{
    "$schema": "https://schema.oparl.org/1.1/Location",
    "id": "https://oparl.example.org/location/0",
    "type": "https://schema.oparl.org/1.1/Location",
    "description": "Deutscher Bundestag, Platz der Republik 1, 11011 Berlin",
    "streetAddress": "Platz der Republik 1",
    "postalCode": "11011",
    "locality": "Berlin",
    "room": "Plenarsaal",
    "geojson": {
        "type": "Feature",
        "geometry": {
            "type": "Point",
            "coordinates": [
                52.518855,
                13.376198
            ]
        },
        "properties": {
            "name": "Reichstagsgeb√§ude"
        }
    }
}
